{
  "format": "crudui/features-manifest",
  "version": "0.0.7",
  "packages": [
    {
      "name": "@polyspec/crudui-generator-core",
      "path": "packages/generator/ts",
      "layer": "model",
      "entries": {
        ".": {
          "visibility": "public",
          "exports": [
            "ComposeLoadError",
            "FormInputError",
            "FormInstance",
            "FormRenderOptionsError",
            "FormTemplateError",
            "UnsupportedFieldTypeError",
            "bindButtons",
            "bindForm",
            "buildDetail",
            "buildList",
            "buildOutline",
            "canRedo",
            "canUndo",
            "collapsibleRows",
            "compileForm",
            "connectForm",
            "connectOutline",
            "connectStickyHeaders",
            "createForm",
            "createRowKey",
            "decodeFormRenderOptions",
            "decodeFormTemplate",
            "emptyHistory",
            "formButtonsHtml",
            "formDescription",
            "formMessages",
            "initialView",
            "patchContent",
            "recordChange",
            "redoChange",
            "rekeyRowView",
            "removeRowView",
            "resolveAction",
            "runAction",
            "sequenceRowKey",
            "setAllExpandedView",
            "toggleRowView",
            "undoChange"
          ]
        },
        "./internal": {
          "visibility": "internal",
          "exports": [
            "CELL_FORMATS",
            "CELL_FORMAT_DEFAULT",
            "CELL_RENDERERS",
            "WIDGET_CANONICAL",
            "WIDGET_COUNT",
            "WIDGET_KINDS",
            "WIDGET_LAYOUTS",
            "actionHtml",
            "affixHtml",
            "buildListLayout",
            "choiceLabelClass",
            "choicesHtml",
            "detailRenderer",
            "escAttr",
            "escText",
            "formRenderModel",
            "groupButtonHtml",
            "hasEventAttr",
            "isUnsupported",
            "listRenderer",
            "optionSections",
            "paginationPages",
            "parseStyle",
            "rawControl",
            "rawElement",
            "rawOptions",
            "rawVoid",
            "searchHtml",
            "serializeAttrs",
            "sortDir",
            "widgetRootHtml"
          ]
        }
      }
    },
    {
      "name": "@polyspec/crudui-generator-html",
      "path": "packages/html",
      "layer": "renderer",
      "entries": {
        ".": {
          "visibility": "public",
          "exports": [
            "renderData",
            "renderDataPanel",
            "renderDetail",
            "renderForm",
            "renderFormView",
            "renderList",
            "renderOutline",
            "renderOutlineView"
          ]
        }
      }
    },
    {
      "name": "@polyspec/crudui-generator-react",
      "path": "packages/react",
      "layer": "renderer",
      "entries": {
        ".": {
          "visibility": "public",
          "exports": [
            "Cell",
            "Controls",
            "DataPanel",
            "DataView",
            "Detail",
            "Form",
            "List",
            "Node",
            "Outline",
            "OutlineView",
            "Widget"
          ]
        },
        "./server": {
          "visibility": "public",
          "exports": [
            "renderDetail",
            "renderForm",
            "renderList"
          ]
        }
      }
    },
    {
      "name": "@polyspec/crudui-generator-vue",
      "path": "packages/vue",
      "layer": "renderer",
      "entries": {
        ".": {
          "visibility": "public",
          "exports": [
            "DataView",
            "Detail",
            "Form",
            "List",
            "Outline",
            "Widget",
            "controlsVNode",
            "dataVNode",
            "nodeVNode",
            "outlineVNode",
            "renderDetail",
            "renderForm",
            "renderList"
          ]
        }
      }
    },
    {
      "name": "@polyspec/crudui-generator-svelte",
      "path": "packages/svelte",
      "layer": "renderer",
      "entries": {
        ".": {
          "visibility": "public",
          "exports": [
            "Controls",
            "DataPanel",
            "DataView",
            "Detail",
            "Form",
            "List",
            "Node",
            "Outline",
            "OutlineView",
            "Widget",
            "renderDetail",
            "renderForm",
            "renderList"
          ]
        }
      }
    },
    {
      "name": "@polyspec/crudui-form-binding",
      "path": "packages/form-binding",
      "layer": "validation",
      "entries": {
        ".": {
          "visibility": "public",
          "exports": [
            "bindForm"
          ]
        }
      }
    },
    {
      "name": "@polyspec/crudui-validator",
      "path": "packages/validator/ts",
      "layer": "validation",
      "entries": {
        ".": {
          "visibility": "public",
          "exports": [
            "ComposeLoadError",
            "FormInputError",
            "hiddenPaths",
            "validate",
            "validateDetail",
            "validateList"
          ]
        },
        "./internal": {
          "visibility": "internal",
          "exports": [
            "ARRAY_LEVEL_RULES",
            "FORBIDDEN_META_KEYS",
            "FORBIDDEN_META_KEY_PATTERN",
            "INVALID_TEXT_MESSAGE",
            "LITERAL_PARAM_RULES",
            "Lexer",
            "MAX_EXPRESSION_DEPTH",
            "MEMBERSHIP_PARAM_RULES",
            "MemoryLoader",
            "PATH_REFERENCE_RULES",
            "ParseError",
            "Parser",
            "REGEX_PARAM_RULES",
            "Validator",
            "checkInputText",
            "checkOptionText",
            "checkSpecificationText",
            "checkedComposition",
            "checkedLoader",
            "compareCodePoints",
            "composeProperties",
            "composeSpec",
            "evaluateCondition",
            "evaluateExpressionValue",
            "getRuleNames",
            "isConditionExpression",
            "isMultiple",
            "isNumberRange",
            "isScalarText",
            "isStep",
            "parseCondition",
            "parseJsonDocument",
            "scanForbiddenKeys"
          ]
        }
      }
    }
  ],
  "examples": [
    {
      "id": "form-instance",
      "input": "packages/html/README.md",
      "expected": "tests/fixtures/form-render/cases.json"
    },
    {
      "id": "list-render",
      "input": "tests/fixtures/list-render/cases.json",
      "expected": "tests/fixtures/list-render/cases.json"
    },
    {
      "id": "validation",
      "input": "tests/fixtures/validate/cases.json",
      "expected": "tests/fixtures/validate/cases.json"
    }
  ],
  "fixtures": [
    {
      "path": "tests/fixtures/compose/cases.json",
      "kind": "composition"
    },
    {
      "path": "tests/fixtures/expr/cases.json",
      "kind": "expression"
    },
    {
      "path": "tests/fixtures/validate/cases.json",
      "kind": "validation"
    },
    {
      "path": "tests/fixtures/spec-validity/cases.json",
      "kind": "spec-validity"
    },
    {
      "path": "tests/fixtures/list-validity/cases.json",
      "kind": "list-validity"
    },
    {
      "path": "tests/fixtures/detail-validity/cases.json",
      "kind": "detail-validity"
    },
    {
      "path": "tests/fixtures/text-validity/validate/cases.json",
      "kind": "input-text"
    },
    {
      "path": "tests/fixtures/text-validity/validateList/cases.json",
      "kind": "input-text"
    },
    {
      "path": "tests/fixtures/text-validity/validateDetail/cases.json",
      "kind": "input-text"
    },
    {
      "path": "tests/fixtures/text-validity/compileForm/cases.json",
      "kind": "input-text"
    },
    {
      "path": "tests/fixtures/text-validity/bindForm/cases.json",
      "kind": "input-text"
    },
    {
      "path": "tests/fixtures/text-validity/createForm/cases.json",
      "kind": "input-text"
    },
    {
      "path": "tests/fixtures/text-validity/buildList/cases.json",
      "kind": "input-text"
    },
    {
      "path": "tests/fixtures/text-validity/buildDetail/cases.json",
      "kind": "input-text"
    },
    {
      "path": "tests/fixtures/form-render/cases.json",
      "kind": "form-html"
    },
    {
      "path": "tests/fixtures/form-complete/cases.json",
      "kind": "form-html"
    },
    {
      "path": "tests/fixtures/form-outline/cases.json",
      "kind": "outline-html"
    },
    {
      "path": "tests/fixtures/list-render/cases.json",
      "kind": "list-html"
    },
    {
      "path": "tests/fixtures/detail-render/cases.json",
      "kind": "detail-html"
    },
    {
      "path": "tests/native-generators/cases.mts",
      "kind": "form-instance",
      "export": "formScenarios"
    },
    {
      "path": "tests/fixtures/form-session/scenario.mts",
      "kind": "browser-session",
      "cases": [
        "exerciseSessionDom"
      ]
    },
    {
      "path": "tests/fixtures/form-session/controls.mts",
      "kind": "browser-session",
      "cases": [
        "exerciseControls"
      ]
    },
    {
      "path": "tests/fixtures/form-session/initialization.mts",
      "kind": "browser-session",
      "cases": [
        "compareServerTakeover",
        "compareInitialization"
      ]
    },
    {
      "path": "tests/fixtures/form-session/data-rows.mts",
      "kind": "browser-session",
      "cases": [
        "exerciseOnlyRows",
        "exerciseHiddenValues"
      ]
    },
    {
      "path": "tests/fixtures/form-session/typing.mts",
      "kind": "browser-session",
      "cases": [
        "exerciseTyping"
      ]
    },
    {
      "path": "tests/fixtures/view-session/rerender.mts",
      "kind": "browser-session",
      "cases": [